{"bytes":18,"complete":true,"coverage_claim":"adapter-all-rows-selected-columns","kind":"postgresql-table-export","output_sha256":"10ab9aba6a1dc35799d9fb6cf2dc5e2862f926fa7e3ab3a61afc9b5591ce7362","postgres_source_summary_version":1,"receipt_sha256":"4b9b22dfd3866fc156fe8d31d2e043434d8925bc9fa2617be517eb4fa3914b35","rows":1}
