{"bytes":26,"complete":true,"coverage_claim":"adapter-all-rows-selected-columns","kind":"postgresql-table-export","output_sha256":"32ff80fd20d1f933aa40977c973a2778d5a4ded6532fbc0a4b035c299d15e975","postgres_source_summary_version":1,"receipt_sha256":"15a858f74430eb61c35a9f56b40a6fcbceda4466d2bc2e246af52f03ab749aac","rows":2}
