{"bytes":39,"complete":true,"coverage_claim":"adapter-all-rows-selected-columns","kind":"postgresql-table-export","output_sha256":"f4c3877f06c18167150fcc43831f956981646919853750001e3a4b64f747c171","postgres_source_summary_version":1,"receipt_sha256":"00139407b5ff80243a60bb2a85af1b09ce5b905f61dd63f6621b309a1f57076e","rows":2}
